questions,lang,keywords
Câte magazine Aldi există?,ro,"avea, Aldi"
What is the capital of Cameroon?,en,"capital, Cameroon"
پایتخت کامرون کجاست؟,fa,پایتخت، کامرون
Was ist die Hauptstadt von Kamerun?,de,"Hauptstadt, Kamerun"
¿Cuál es la capital de Camerún?,es,"capital, Camerún"
Qual è la capitale del Cameroon,it,"capitale, Cameroon"
Quelle est la capitale du Cameroun?,fr,"capitale, Cameroun"
Wat is de hoofdstad van Kameroen?,nl,"hoofdstad, Kameroen"
कैमरून की राजधानी क्या है?,hi_IN,"कैमरून, राजधानी"
Care este capitala Camerunului?,ro,"capitală, Camerun"
Is there a video game called Battle Chess?,en,"video game, Battle Chess"
"Gibt es ein Videospiel, das Battle Chess heißt?",de,"Videospiel, Battle Chess"
¿Hay algún videojuego que se llame Battle Chess?,es,"videojuego, Battle Chess"
Esiste un videogioco che si chiama Battle Chess?,it,"videogioco, Battle Chess"
Existe-t-il un jeu vidéo appelé Battle Chess?,fr,"jeu vidéo, Battle Chess"
Bestaat er een videospel met de naam Battle Chess?,nl,"videospel, Battle Chess"
क्या बैटल चैस नामक वीडियो गेम है?,hi_IN,"बैटल चैस, वीडियो गेम"
Was the wife of president Lincoln called Mary?,en,"Lincoln, president, wife, called, Mary"
Hieß die Frau von Präsident Lincoln Mary?,de,"Lincoln, Präsident, Frau, heißen, Mary"
¿La mujer del presidente Lincoln se llama Mary?,es,"mujer, presidente, Lincoln, se lamma, Mary"
La moglie del presidente Lincoln si chiamava Mary?,it,"moglie, presidente, Lincoln, si chiama, Mary"
Est-ce que l'épouse du président Lincoln s'appelait Mary?,fr,"épouse, Lincoln, Mary, appelle"
Heette de echtgenote van president Lincoln Mary?,nl,"echtgenote, Lincoln, Mary"
क्या राष्ट्रपति लिंकन की पत्नी का नाम मैरी था?,hi_IN,"राष्ट्रपति लिंकन, पत्नी, मैरी"
Este soția președintelui Lincoln numită Mary?,ro,"Lincoln, președinte, soție, numită, Mary"
Give me all movies directed by Francis Ford Coppola.,en,"movie, direct, Francis Ford Coppola"
تمام فیلم های کارگردانی شده توسط فرانسیس فورد کوپولا را لیست کن.,fa,فیلم، کارگردانی، فرانسیس فورد کوپولا
"Gib mir alle Filme, bei denen Francis Ford Coppola Regie geführt hat.",de,"Film, Regie, Francis Ford Coppola"
Dame todas las películas que haya dirigido Francis Ford Coppola.,es,"película, director, Francis Ford Coppola"
Dammi tutti i film diretti da Francis Ford Coppola.,it,"film, dirigere, Francis Ford Coppola"
Donnes-moi tous les films dont Francis réalisés par Francis Ford Coppola.,fr,"film, directeur, Francis Ford Coppola"
Geef alle films die werden geregisseerd door Francis Ford Coppola.,nl,"films, regisseur, Francis Ford Coppola"
मुझे फ्रांसिस फोर्ड कोपोला द्वारा निर्देशित सभी फिल्मों की सूचि दे ।,hi_IN,"फ्रांसिस फोर्ड कोपोला, निर्देशित, फिल्मों"
Dă-mi toate filmele regizate de Francis Ford Coppola.,ro,"film, regizat, Francis Ford Coppola"
Which of Tim Burton's films had the highest budget?,en,"highest budget, film, Tim Burton"
Welcher von Tim Burtons Filmen hatte das höchste Budget?,de,"höchstes Budget, Film, Tim Burton"
¿Cuál es la película de Tim Burton con el mayor presupuesto?,es,"película de Tim Burton, mayor presupuesto"
Quali film di Tim Burton hanno avuto il budget più alto?,it,"budget più alto, film, Tim Burton"
Quel film de Tim Burton a le budget le plus haut?,fr,"budget le plus haut, Tim Burton"
Welke van Tim Burton's films had het hoogste budget?,nl,"film, Tim Burton, hoogste budget"
टिम बर्टन की फिल्मों में से कौन सी का सबसे ज्यादा बजट था?,hi_IN,"टिम बर्टन, फिल्मो, सबसे ज्यादा बजट"
Care dintre filmele lui Tom Burton a avut cel mai mare buget?,ro,"cel mai mare buget, film, Tim Burton"
Does Breaking Bad have more episodes than Game of Thrones?,en,"Breaking Bad, episodes, more than, Game of Thrones"
Hat Breaking Bad mehr Episoden als Game of Thrones?,de,"Breaking Bad, Episoden, mehr als, Game of Thrones"
¿Tiene Breaking Bad más episodios que Game of Thrones?,es,"Breaking Bad, episodios, más que, Game of Thrones"
Breaking Bad ha più episodi di Game of Thrones?,it,"Breaking Bad, eposido, più di, Game of Thrones"
A Breaking Bad plus d'épisodes que Game of Thrones?,fr,"Breaking Bad, épisodes plus que, Game of Thrones"
Heeft Breaking Bad meer afleveringen dan Game of Thrones?,nl,"Breaking Bad, afleveringen, meer dan, Game of Thrones"
ब्रेकिंग बैड में गेम ऑफ़ थ्रोन्स की तुलना में अधिक एपिसोड हैं?,hi_IN,"ब्रेकिंग बैड, गेम ऑफ़ थ्रोन्स, अधिक एपिसोड"
Are Breaking Bad mai multe episoade decât Game of Thrones?,ro,"Breaking Bad, episoade, mai multe decât, Game of Thrones"
Was Natalie Portman born in the United States?,en,"Natalie Portman, born, United States"
Wurde Natalie Portman in den Vereinigten Staaten geboren?,de,"Natalie Portman, geboren, Vereinigte Staaten"
¿Nació Natalie Portman en los estados unidos de américa?,es,Natalie Portman
"Natalie Portman, nata, Stati Uniti d'America",it,"Natalie Portman, nata, Stati Uniti d'America"
Natalie Portman est-elle née aux Etats-Unis?,fr,"Natalie Portman, née, Etats-Unis"
Werd Natalie Portman geboren in de Verenigde Staten?,nl,"Natalie Portman, geboren, Verenigde Staten"
क्या नेटली पोर्टमैन संयुक्त राज्य में पैदा हुइ थी ?,hi_IN,"नेटली पोर्टमैन, संयुक्त राज्य, पैदा"
Give me the grandchildren of Elvis Presley.,en,"Elvis Presley, grandchildren"
نوه های الویس پرسلی را لیست کن.,fa,نوه های، الویس پرسلی
Gib mir die Enkel von Elvis Presley.,de,"Elvis Presley, Enkel"
Dame todos los nietos de Elvis Presley.,es,"Elvis Presley, nietos"
Dammi i nipoti di Elvis Presley.,it,"Elvis Presley, nipoti"
Donne-moi tous les petit-enfants de Elvis Presley.,fr,"petit-enfants, Elvis Presley"
Toon alle kleinkinderen van Elvis Presley.,nl,"Elvis Presley, kleinkinderen"
मुझे एल्विस प्रेस्ली के पोतों के नाम दे। ,hi_IN,"एल्विस प्रेस्ली, पोतो के नाम"
Dă-mi nepoții lui Elvis Presley.,ro,"Elvis Presley, nepoți"
Which movies starring Mickey Rourke were directed by Guy Ritchie?,en,"movies, starring, Mickey Rourke, directed, Guy Ritchie"
چه فیلم هایی با بازی میکی رورک توسط گای ریچی کارگردانی شدند؟,fa,فیلم هایی، بازی، میکی رورک، گای ریچی، کارگردانی
"Bei welchen Filmen, in denen Mickey Rourke mitspielt, hat Guy Ritchie Regie geführt?",de,"Filme, mitspielen, Mickey Rourke, Regie führen, Guy Ritchie"
¿Que peliculas protagonizadas por Mickey Rourke han sido dirigidas por Guy Ritchie?,es,"peliculas, protagonizadas, Mickey Rourke, dirigidas, Guy Ritchie"
Quali film in cui recita Mickey Rourke sono stati diretti da Guy Ritchie?,it,"film, attore, Mickey Rourke, diretti, Guy Ritchie"
Quels films avec Mickey Rourke furent dirigés par Guy Richtie?,fr,"films, acteur, Mickey Rourke, directeur, Guy Richtie?"
Welke films met Mickey Rourke werden geregisseerd door Guy Ritchie?,nl,"films, acteur, Mickey Rourke, geregisseerd, Guy Ritchie"
मिकी रोर्के अभिनीत कौन सी फिल्में गाए रिची द्वारा निर्देशित थीं?,hi_IN,"मिकी रोर्, अभिनीत, गाए रिची, निर्देशित"
Ce filme cu Mickey Rourke ca protagonist au fost regizate de Guy Ritchie?,ro,"filme, Mickey Rourke, protagonist, regizate, Guy Ritchie"
Which country does the creator of Miffy come from?,en,"Miffy, creator, country"
Aus welchem Land kommt der Erfinder von Nijntje?,de,"Nijntje, Erfinder, Land"
¿De qué país viene el creador de Nijntje?,es,"Njintje, creados, país"
Da quale stato proviene il creatore di Miffy?,it,"Miffy, creatore, nazione"
De quel pays vient le créateur de Miffy?,fr,"pays, créateur, Miffy"
Uit welk land komt de bedenker van Nijntje?,nl,"Nijntje, bedenker, nationaliteit"
मिफ्फी के निर्माता किस देश से आते है?,hi_IN,"मिफ्फ, निर्माता, देश"
What form of government does Russia have?,en,"form of government, Russia"
روسیه چه نوع حکومتی دارد؟,fa,روسیه، نوع حکومت
Welche Regierungsform hat Russland?,de,"Russland, Regierungsform"
¿Qué forma de gobierno tiene Rusia?,es,"forma de gobierno, Rusia"
Quale forma di governo ha la Russia?,it,"forma di governo, Russia"
Quelle est la forme de gouvernement de la Russie?,fr,"forme de gouvernement, Russie?"
Welke regeringsvorm heeft Rusland?,nl,"regeringsvorm, Rusland"
रूस की सरकार किस प्रकार की है?,hi_IN,"रूस, सरकार, प्रकार"
Ce formă de guvern are Rusia?,ro,"formă de guvern, Rusia"
Give me all Canadian Grunge record labels.,en,"record label, Canadian, Grunge"
Gib mir alle kanadischen Grunge-Plattenfirmen.,de,"kanadisch, Plattenfirma, Grunge"
Dame todos las empresas canadienses productoras de música Grunge.,es,"empresa productora de música, canadiense, Grunge"
Dammi tutti i produttori canadesi di musica Grunge.,it,"produttore di musica, canadese, Grunge"
Donnes-moi tous les labels discographiques canadiens de grunge.,fr,"labels discographiques, canadiens, grunge"
Noem alle Canadese grunge-platenlabels.,nl,"Canadees, platenlabel, Grunge"
मुझे सभी कैनेडियन ग्रांज रिकॉर्ड लेबल की सूचि दें।,hi_IN,"कैनेडियन, ग्रांज, रिकॉर्ड लेबल"
How many children did Benjamin Franklin have?,en,"Benjamin Franklin, child"
بنجامین فرانکلین چند فرزند دارد؟,fa,بنجامین فرانکلین، فرزند
Wieviele Kinder hatte Benjamin Franklin?,de,"Benjamin Franklin, Kind"
¿Cuántos hijos tuvo Benjamin Franklin?,es,"Benjamin Franklin, hijos"
Quanti figli ebbe Benjamin Franklin?,it,"Benjamin Franklin, figlio"
Combien d'enfants Benjamin Franklin avait-il?,fr,"nombre d'enfants, Benjamin Franklin"
Hoeveel kinderen had Benjamin Franklin?,nl,"Benjamin Franklin, kinderen, hoeveel"
बेंजामिन फ्रैंकलिन के कितने बच्चे हैं?,hi_IN,"बेंजामिन फ्रैंकलिन, बच्चे"
Câți copii a avut Benjamin Franklin?,ro,"Benjamin Franklin, copil"
List the children of Margaret Thatcher.,en,"Margaret Thatcher, child"
Liste die Kinder von Margaret Thatcher auf.,de,"Margaret Thatcher, Kind"
Dame una lista de los hijos de Margaret Thatcher.,es,"Margaret Thatcher, hijos"
Elenca i figli di Margaret Thatcher.,it,"Margaret Thatcher, figlio"
Donnes-moi tous les enfants de Margaret Thatcher.,fr,"enfants, Margaret Thatcher"
Noem alle kinderen van Margaret Thatcher.,nl,"kinderen, Margaret Thatcher"
मार्गरेट थैचर के बच्चों की सूची बनाएं।,hi_IN,"मार्गरेट थैचर, बच्चों"
From which region is the Melon de Bourgogne?,en,"region, Melon de Bourgogne"
Aus welcher Region ist der Melon de Bourgogne?,de,"Region, Melon de Bourgogne"
¿De que región es el vino Melon de Bourgogne?,es,"región, Melon de Bourgogne"
Da quale regione proviene il Melon de Bourgogne?,it,"regione, Melon de Bourgogne"
De quelle région vient le Melon de Bourgogne?,fr,"région, Melon de Bourgogne"
Vanuit welke regio is de Melon de Bourgogne?,nl,"regio, Melon de Bourgogne"
मेलन डी बर्गोगोन किस क्षेत्र से है?,hi_IN,"मेलन डी बर्गोगोन, क्षेत्र"
Din ce regiune provine Melon-ul de Bourgogne?,ro,"regiune, Melon de Bourgogne"
Who is the oldest child of Meryl Streep?,en,"oldest child, Meryl Streep"
Wer ist das älteste Kind von Meryl Streep?,de,"ältestes Kind, Meryl Streep"
¿Cuál es el hijo mas mayor de Meryl Streep?,es,"hijo mas mayor, Meryl Streep"
Chi è il figlio maggiore di Meryl Streep?,it,"figlio maggiore, Meryl Streep"
Qui est l'enfant le plus agé de Merly Streep?,fr,"enfant le plus agé, Meryl Streep"
Wie is het oudste kind van Meryl Streep?,nl,"oudste kind, Meryl Streep"
मेरिल स्ट्रीप का सबसे पहला बच्चा कौन है?,hi_IN,"मेरिल स्ट्रीप, सबसे पहला बच्चा"
Cine este copilul cel mai mare al lui Meryl Streep?,ro,"copilul cel mai mare, Meryl Streep"
Are tree frogs a type of amphibian?,en,"tree frog, amphibian"
Sind Laubfrösche Amphibien?,de,"Laubfrosch, Amphibie"
¿Son las ranas verdes un tipo de anfibio?,es,"rana verde, anfibio"
Le rane verdi sono un tipo di anfibio?,it,"rana verde, anfibio"
Sont les grenouilles arboricoles un type d'amphibiens?,fr,"grenouilles arboricoles, amphibien"
Zijn boomkikkers een soort amfibie?,nl,"boomkikker, amfibie"
क्या वृक्ष के मेंढक एक प्रकार की उभयचर हैं?,hi_IN,"वृक्ष के मेंढक, प्रकार, उभयचर"
Sunt broaștele de copac un tip de amfibieni?,ro,"broască de copac, amfibian"
Is Christian Bale starring in Velvet Goldmine?,en,"Christian Bale, starring, Velvet Goldmine"
Spielt Christian Bale in Velvet Goldmine mit?,de,"Christian Bale, mitspielen, Velvet Goldmine"
¿Actúa Christian Bale en Velvet Goldmine?,es,"Christian Bale, actúa, Velvet Goldmine"
Christian Bale ha recitato in Velvet Goldmine?,it,"Christian Bale, recitare, Velvet Goldmine"
Christian Bale joue-t-il dans Velvet Goldmine?,fr,"Christian Bale, joue, Velvet Goldmine"
Speelt Christian Bale in Velvet Goldmine?,nl,"Christian Bale, speelt in, Velvet Goldmine"
क्या वेलवेट गोल्डमाइन में अभिनीता क्रिस्चियन बेल है?,hi_IN,"वेलवेट गोल्डमाइन, अभिनीता, क्रिस्चियन बेल"
Joacă Christian Bale un rol principal în Velvet Goldmine?,ro,"Christian Bale, rol principal, Velevet Goldmine"
List all games by GMT.,en,"game, GMT"
Liste alle Spiele von GMT auf.,de,"Spiel, GMT"
Dame todos los juegos de GMT.,es,"juegos, GMT"
Elenca tutti i giochi di GMT.,it,"gioco, GMT"
Donne-moi tous les jeux de GMT.,fr,"jeux, GMT"
Noem alle spelen van GMT.,nl,"spel, GMT"
जीएमटी द्वारा सभी खेलों की सूची बनाएं।,hi_IN,"जीएमटी, खेल"
Does the Isar flow into a lake?,en,"Isar, flow, lake"
Fließt die Isar in einen See?,de,"Isar, fließt, See"
¿Desemboca el Isar en un lago?,es,"Isar, desemboca, lago"
L'Isar sfocia in un lago?,it,"Isar, sfociare, lago"
L'Isar se déverse-t-il dans un lac?,fr,"Isar, deverse, lac"
Mondt de Isar uit in een meer?,nl,"Isar, uitmonden, meer"
क्या ईसार एक झील में प्रवाहित होती है?,hi_IN,"ईसार, झील, प्रवाहित"
Isarul se varsă într-un lac?,ro,"Isar, varsă, lac"
Which airports does Yeti Airlines serve?,en,"airports, Yeti Airlines"
یتی ایرلاینرز در چه فرودگاه هایی فعالیت می کند؟,fa,یتی ایرلاینرز، فرودگاه هایی
Welche Flughäfen fliegt Yeti Airlines an?,de,"Flughäfen, anfliegen, Yeti Airlines"
¿Qué aeropuertos sirve Yeti Airlines?,es,"aeropuertos, Yeti Airlines"
Quali aeroporti sono serviti da Yeti Airlines?,it,"aeroporti, Yeti Airlines"
Quels sont les aéroports servis par Yeti Airlines?,fr,"Yeti Airlines, aéroports"
Naar welke luchthavens vliegt Yeti Airlines?,nl,"luchthavens, Yeti Airlines"
यति एयरलाइंस किस हवाई अड्डे की सेवा करती है?,hi_IN,"यति एयरलाइंस, हवाई अड्ड, सेवा"
Ce aeroporturi deservește Yeti Airlines?,ro,"aeroporturi, Yeti Airlines"
Which Indian company has the most employees?,en,"Indian company, the most employees"
کدام شرکت هندی بیشترین تعداد کارمند را دارد؟,fa,شرکت هندی، بیشترین تعداد کارمند
Welches indische Unternehmen hat die meisten Angestellten?,de,"Unternehmen, Indien, die meisten Angestellten"
¿Qué empresa de la India tiene el mayor número de empleados?,es,"empresa India, mayor número empleados"
Quale società indiana ha il maggior numero di dipendenti?,it,"società indiana, maggior numero di dipendenti"
Quelle companie indienne a le plus d'employés?,fr,"companie indienne, maximum d'employés"
Welke Indiase bedrijf heeft de meeste werknemers?,nl,"Indiase bedrijf, de meeste werknemers"
किस भारतीय कंपनी में सबसे अधिक कर्मचारी हैं?,hi_IN,"भारतीय, कंपनी, सबसे अधिक कर्मचारी"
Ce companie indiană are cei mai mulți angajați?,ro,"companie indiană, cei mai mulți angajați"
Which city has the most inhabitants?,en,"city, the most inhabitants"
Welche Stadt hat die meisten Einwohner?,de,"Stadt, meisten Einwohner"
¿Que ciudad tiene la mayor población?,es,"ciudad, mayor población"
Quale città ha il maggior numero di abitanti?,it,"città, maggior numero di abitanti"
Quel ville a le plus grand nombre d'habitants?,fr,"ville, plus grand nombre d'habitants"
Welke stad heeft de meeste inwoners?,nl,"stad, meeste inwoners"
कौन से शहर में सबसे अधिक निवासी है?,hi_IN,"शहर, सबसे अधिक निवासी"
Care oraș are cei mai mulți locuitori?,ro,"oraș, cei mai mulți locuitori"
Who created Wikipedia?,en,"Wikipedia, created"
Wer hat Wikipedia gegründet?,de,"Wikipedia, gründen"
¿Quién creó Wikipedia?,es,"Wikipedia, creador"
Chi ha creato Wikipedia?,it,"Wikipedia, creatore"
Qui est le créateur de Wikipedia?,fr,"créateur, Wikipedia"
Wie heeft Wikipedia opgericht?,nl,"Wikipedia, oprichter"
विकिपीडिया किसने बनाया?,hi_IN,"विकिपीडिया, निर्माता"
Is Rita Wilson the wife of Tom Hanks?,en,"Rita Wilson, wife, Tom Hanks"
Ist Rita Wilson die Frau von Tom Hanks?,de,"Rita Wilson, Frau, Tom Hanks"
¿Es Rita Wilson la esposa de Tom Hanks?,es,"Rita Wilson, esposa, Tom Hanks"
Rita Wilson è la moglie di Tom Hanks?,it,"Rita Wilson, moglie, Tom Hanks"
Rita Wilson est-elle l'épouse de Tom Hanks?,fr,"Rita Wilson, épouse, Tom Hanks"
Is Rita Wilson de vrouw van Tom Hanks?,nl,"Rita Wilson, vrouw, Tom Hanks"
क्या रीटा विल्सन टॉम हैंक्स की पत्नी है?,hi_IN,"रीटा विल्सन, टॉम हैंक्स, पत्नी"
Este Rita Wilson soția lui Tom Hanks?,ro,"Rita Wilson, soție, Tom Hanks"
Is the wife of president Obama called Michelle?,en,"Obama, president, wife, called, Michelle"
Heißt die Frau von Präsident Obama Michelle?,de,"Obama, Präsident, Frau, heißen, Michelle"
¿La mujer del presidente Obama se llama Michelle?,es,"mujer, presidente, Obama, se lamma, Michelle"
La moglie del presidente Obama si chiama Michelle?,it,"moglie, presidente, Obama, si chiama, Michelle"
L'épouse du président Obama s'appelle-t-elle Michelle?,fr,"épouse, Obama, Michelle, appelle"
Heet de echtgenote van president Barack Obama Michelle?,nl,"echtgenote, Barack Obama, Michelle"
क्या राष्ट्रपति ओबामा की पत्नी का नाम मिशेल है?,hi_IN,"राष्ट्रपति ओबामा, पत्नी, मिशेल"
How many ethnic groups live in Slovenia?,en,"how many, ethnic groups, Slovenia"
چند گروه نژادی در اسلوونی زندگی می کنند؟,fa,گروه نژادی، اسلوونی
Wieviele ethnische Gruppen leben in Slovenien?,de,"Anzahl, ethnische Gruppen, Slovenien"
¿Cuántos grupos étnicos viven en Eslovenia?,es,grupos étnicos Eslovenia
Quanti gruppi etnici vivono in Slovenia?,it,"numero, gruppi etnici, Slovenia"
Combien de groupes ethniques vivent en Slovénie?,fr,"nombre, groupes ethniques, Slovénie"
Hoeveel etnische groepen leven in Slovenië?,nl,"hoeveel, etnische groepen, Slovenië"
कितने जातीय समूह स्लोवेनिया में रहते हैं?,hi_IN,"जातीय समूह, स्लोवेनिया"
Câte grupuri etnice trăiesc în Slovenia?,ro,"câte, grupuri etnice, Slovenia"
Who is the president of Eritrea?,en,"president, Eritrea"
رئیس جمهور اریتره کیست؟,fa,رئیس جمهور، اریتره
Wer ist der Präsident von Eritrea?,de,"Präsident, Eritrea"
¿Quién es el presidente de Eritrea?,es,presidente Eritrea
Chi è il presidente dell'Eritrea?,it,"presidente, Eritrea"
Qui est le président de l'Érytrée?,fr,"président, Erythrée"
Wie is de president van Eritrea?,nl,"president, Eritrea"
इरीट्रिया के राष्ट्रपति कौन है?,hi_IN,"इरीट्रिया, राष्ट्रपति"
Cine este președintele Eritreei?,ro,"președinte, Eritreea"
Which films did Stanley Kubrick direct?,en,"film, Stanley Kubrick, direct"
چه فیلم هایی را استنلی کوبریک کارگردانی کرده است؟,fa,فیلم هایی، استنلی کوبریک، کارگردانی
Bei wievielen Filmen hat Stanley Kubrick Regie geführt?,de,"wieviele, Filme, Stanley Kubrick, Regie"
¿Qué películas dirigio Stanley Kubrick?,es,"películas, director, Stanley Kubrick"
Quanti film ha diretto Stanley Kubrick?,it,"film, Stanley Kubrick, dirigere"
Quels films ont été dirigés par Stanley Kubrick?,fr,"films, directeur, Stanley Kubrick"
Hoveel films heeft Stanley Kubrick geregisseerd?,nl,"films, Stanley Kubrick, regisseur"
स्टैनले कुब्री ने कौन सी फिल्मे निर्देशित की हैं ?,hi_IN,"स्टैनले कुब्री, फिल्म, निर्देशित"
Ce filme a regizat Stanley Kubrick?,ro,"film, Stanley Kubrick, regiza"
When was the Titanic completed?,en,"Titanic, completion date"
Wann wurde die Titanic fertiggestellt?,de,"Titanic, fertiggestellt, Datum"
¿Cuando se completo el Titanic?,es,"fecha de acabado, Titanic"
Quando è stato completato il Titanic?,it,"Titanic, data, completamento"
Quand a été terminé le Titanic?,fr,"data de terminaison, Titanic"
Wanneer was de Titanic afgewerkt?,nl,"Titanic, wanneer, afgewerkt"
टाइटैनिक कब पूरा हुआ?,hi_IN,"टाइटैनिक, पूरा"
Când a fost terminat Titanicul?,ro,"Titanic, data terminării"
How many pages does War and Peace have?,en,"how many, pages, War and Peace"
Wieviele Seiten hat Krieg und Frieden?,de,"wieviele, Seiten, Krieg und Frieden"
¿Cuántas páginas tiene Guerra y Paz?,es,"número paginas, Guerra y Paz"
Quante pagine ha Guerra e Pace?,it,"pagine, Guerra e Pace"
Combien de pages a Guerre et Paix?,fr,"nomber de pages, Guerre et Paix"
Hoeveel pagina's heeft Oorlog en vrede?,nl,"hoeveel pagina's, Oorlog en vrede"
वॉर एंड पीस में कितने पृष्ठ हैं?,hi_IN,"वॉर एंड पीस, कितने पृष्ठ"
Câte pagini are Război și Pace?,ro,"câte pagini, Război și Pace"
What is the highest mountain in Italy?,en,"highest, mountain, Italy"
Was ist der höchste Berg in Italien?,de,"höchste, Berg, Italien"
¿Cuál es la montaña mas alta en Italia?,es,la montaña mas alta Italia
Qual è la montagna più alta in Italia?,it,"montagna, più alta, Italia"
Quelle est la plus haute montagne d'Italie?,fr,"plus haute, plus haute, Italie"
Wat is de hoogste berg in Italië?,nl,"hoogste, berg, Italië"
इटली में सर्वोच्च पर्वत कोनसा है?,hi_IN,"इटली, सर्वोच्च पर्वत"
Care este cel mai înalt munte din Italia?,ro,"cel mai înalt, munte, Italia"
How tall is Claudia Schiffer?,en,"Claudia Schiffer, tall"
Wie groß ist Claudia Schiffer?,de,"Claudia Schiffer, groß"
¿Cómo de alta es Claudia Schiffer?,es,"Claudia Schiffer, altura"
Quanto è alta Claudia Schiffer?,it,"Claudia Schiffer, altezza"
Quelle est la taille de Claudia Schiffer?,fr,"taille, Claudia Schiffer"
Hoe lang is Claudia Schiffer?,nl,"lengte, Claudia Schiffer"
क्लाउडिया शिफ़ेर कितनी लंबी है?,hi_IN,"क्लाउडिया शिफ़ेर, कितनी लंबी"
Who was John F. Kennedy's vice president?,en,"John F. Kennedy, vice president"
Wer war der Vizepräsident unter John F. Kennedy?,de,"John F. Kennedy, Vizepräsident"
¿Quién fué el vicepresidente de John F. Kennedy?,es,"John F. Kennedy, vicepresidente"
Chi fu il vicepresidente di John F. Kennedy?,it,"John F. Kennedy, vicepresidente"
Qui était le vice-président de John F. Kennedy?,fr,"John F. Kennedy, vice-président"
Wie was de vicepresident onder John F. Kennedy?,nl,"John F. Kennedy, vicepresident"
